{
    "$schema": "http://json-schema.org/draft-04/schema#",
    "type": "object",
    "properties": {
      "company": {
        "type": "object",
        "properties": {
          "company_id": { "type": "integer" },
          "company_name": { "type": "string" },
          "company_code": { "type": "string" },
          "image_url": { "type": "string" },
          "company_host": { "type": "string" }
        },
        "required": ["company_id", "company_name", "company_code", "image_url", "company_host"]
      },
      "client": {
        "type": "object",
        "properties": {
          "client_id": { "type": "integer" },
          "name": { "type": "string" },
          "address": { "type": "string" },
          "city": { "type": "string" },
          "province": { "type": "string" },
          "postal_code": { "type": "string" },
          "phone": { "type": ["string", "null"] },
          "email": { "type": ["string", "null"] }
        },
        "required": ["client_id", "name", "address", "city", "province", "postal_code"]
      },
      "invoice": {
        "type": "object",
        "properties": {
          "invoice_id": { "type": "integer" },
          "invoice_number": { "type": "string" },
          "client_id": { "type": "integer" },
          "project_no": { "type": "string" },
          "invoice_date": { "type": "string", "format": "date" },
          "terms": { "type": "string" },
          "total_amount": { "type": "number" },
          "status": { "type": "string", "enum": ["Pending", "Paid", "Overdue"] },
          "company_code": { "type": "string" }
        },
        "required": ["invoice_id", "invoice_number", "client_id", "project_no", "invoice_date", "terms", "total_amount", "status", "company_code"]
      },
      "invoice_items": {
        "type": "array",
        "items": {
          "type": "object",
          "properties": {
            "invoice_id": { "type": "integer" },
            "description": { "type": "string" },
            "quantity": { "type": "number" },
            "rate": { "type": "number" },
            "amount": { "type": "number" }
          },
          "required": ["invoice_id", "description", "quantity", "rate", "amount"]
        }
      },
      "payments": {
        "type": "array",
        "items": {
          "type": "object",
          "properties": {
            "invoice_id": { "type": "integer" },
            "payment_date": { "type": "string", "format": "date" },
            "amount_paid": { "type": "number" },
            "payment_method": { "type": "string" },
            "reference_number": { "type": "string" }
          },
          "required": ["invoice_id", "payment_date", "amount_paid", "payment_method", "reference_number"]
        }
      }
    },
    "required": ["company", "client", "invoice", "invoice_items", "payments"]
  }
  